peraturan,sumber
Penyediaan infrastruktur dan non infrastruktur antara menteri teknis/pimpinan lembaga/kepala daerah dengan badan usaha yang ditetapkan melalui pelelangan umum.,Peraturan Pemerintah Nomor 8 Tahun 2007
"Ketentuan mengenai tukar-menukar informasi sebagaimana
dimaksud pada ayat (1) diatur dalam Peraturan Bank
Indonesia.",Undang-Undang Nomor 21 Tahun 2008
Kepesertaan Tapera berakhir karena: a. telah pensiun bagi Pekerja; b. telah mencapai usia 58 (lima puluh delapan) tahun bagi Pekerja Mandiri; c. Peserta meninggal dunia; atau d. Peserta tidak memenuhi lagi kriteria sebagai Peserta selama 5 (lima) tahun berturut-turut.,Peraturan Pemerintah Nomor 25 Tahun 2020
"Pengurus semua perusahaan/badan yang berusaha/bekerja di
Indonesia wajib memberikan segala keterangan dan angka-angka
yang diperlukan oleh Menteri yang bersangkutan untuk
kepentingan pelaksanaan ketentuan-ketentuan yang ditetapkan
dalam atau berdasarkan Peraturan Pemerintah Pengganti
Undang-undang ini.",Peraturan Pemerintah Pengganti Undang-Undang Nomor 7 Tahun 1962
"Pelaksanaan investasi pemerintah melalui pembelian surat utang dapat dilaksanakan atas surat utang yang diterbitkan perusahaan, pemerintah, dan negara lain.",Peraturan Pemerintah Nomor 8 Tahun 2007
Ketentuan lebih lanjut mengenai mekanisme kepesertaan masyarakat yang telah menerima manfaat dana Fasilitas Likuiditas Pembiayaan Perumahan sebagaimana dimaksud pada ayat (1) diatur oleh menteri yang menyelenggarakan urusan pemerintahan di bidang perumahan dan kawasan permukiman.,Peraturan Pemerintah Nomor 8 Tahun 2007
"Dalam hal anggaran diperkirakan defisit melampaui
target yang ditetapkan dalam APBN, Pemerintah dapat
menggunakan dana SAL, penarikan pinjaman siaga
dan/atau penerbitan SBN sebagai tambahan pembiayaan.",Undang-Undang Nomor 27 Tahun 2014
"Komite Investasi Pemerintah adalah pihak yang memberikan kajian, penetapan kriteria, dan evaluasi atas pelaksanaan investasi oleh Badan Investasi Pemerintah.",Peraturan Pemerintah Nomor 1 Tahun 2008
Manajer Investasi yang melanggar ketentuan sebagaimana dimaksud dalam Pasal 52 ayat (2) dikenai sanksi administratif berupa peringatan tertulis.,Peraturan Pemerintah Nomor 8 Tahun 2007
Kepala badan investasi pemerintah dapat melakukan divestasi terhadap kepemilikan investasi langsung dengan terlebih dahulu mendapat persetujuan Menteri Keuangan.,Peraturan Pemerintah Nomor 8 Tahun 2007
"Surplus anggaran sebagaimana dimaksud pada Ayat
(3) terjadi apabila Anggaran Pendapatan Daerah lebih
besar dari Anggaran Belanja Daerah.",Peraturan Menteri Nomor 29 Tahun 2002
"Subbidang Perdagangan Internasional 1 mempunyai tugas melakukan penyiapan bahan koordinasi,
telaahan staf, pengkajian dan evaluasi, serta penyusunan rancangan rumusan kebijakan di bidang
organisasi perdagangan dunia.",Peraturan Menteri Nomor 9 Tahun 2001
"Bank Syariah dan UUS wajib menyampaikan kepada Bank
Indonesia laporan keuangan berupa neraca tahunan dan
perhitungan laba rugi tahunan serta penjelasannya yang
disusun berdasarkan prinsip akuntansi syariah yang berlaku
umum, serta laporan berkala lainnya, dalam waktu dan
bentuk yang diatur dengan Peraturan Bank Indonesia.",Undang-Undang Nomor 21 Tahun 2008
"Atas usul Panitia, Pimpinan BAPPENAS dapat membentuk team-team kerja
untuk menjalankan kegiatan-kegaitan tertentu guna membantu Panitia.",Peraturan Presiden Nomor 10 Tahun 1964
"Pinjaman dengan persyaratan lunak sebagaimana dimaksud pada
ayat (1), diberikan dalam rangka menutup financing gap PT
Perusahaan Listrik Negara (Persero) akibat pengadaan dan
penggantian trafo serta penguatan instalasi, transmisi, dan
distribusi, serta investasi lainnya.",Peraturan Presiden Nomor 9 Tahun 2011
"Biro Umum membawahkan:
Bagian Kepegawaian;
Bagian Administrasi;
Bagian Keuangan;
Bagian Rumah Tangga.",Peraturan Menteri Nomor 9 Tahun 2001
"Untuk melaksanakan pembayaran ganti rugi kepada korban menurut
ketentuan tersebut dalam ayat (1) pasal ini Menteri dapat menunjuk
instansi Pemerintah yang dianggap perlu.",Undang-Undang Nomor 34 Tahun 1964
Peserta memperoleh pengembalian Simpanan dan hasil pemupukan Dana Tapera berdasarkan jumlah unit penyertaan yang dimiliki Peserta dikalikan nilai aktiva bersih per unit penyertaan pada tanggal berakhirnya kepesertaan.,Peraturan Pemerintah Nomor 8 Tahun 2007
"Pengusaha/pemilik alat angkutan lalu-lintas jalan diharuskan memberi
sumbangan wajib setiap tahun kepada Dana yang dimaksud dalam
pasal 1.",Undang-Undang Nomor 34 Tahun 1964
"Investasi pemerintah dalam rangka pengembangan bidang usaha lainnya sebagaimana dimaksud dalam Pasal 4 ayat (1) huruf d, dilakukan untuk pembelian surat berharga yang bertujuan untuk mendapatkan manfaat ekonomi.",Peraturan Pemerintah Nomor 8 Tahun 2007
"Staf Ahli Bidang Pengembangan Ekonomi Makro dan Keuangan
mempunyai tugas memberikan telaahan mengenai masalah
pengembangan ekonomi makro dan keuangan.",Peraturan Presiden Nomor 176 Tahun 2000
"Perubahan lebih lanjut Pembiayaan Anggaran berupa
perubahan pagu Penerusan Pinjaman luar negeri akibat
dari lanjutan dan percepatan penarikan Penerusan
Pinjaman luar negeri, ditetapkan oleh Pemerintah.",Undang-Undang Nomor 27 Tahun 2014
DAU sebagaimana dimaksud dalam Pasal 8 huruf d merupakan alokasi dana tersendiri dalam pengelolaan Keuangan Haji.,Peraturan Pemerintah Nomor 5 Tahun 2018
Pekerja Mandiri adalah setiap warga negara Indonesia yang bekerja dengan tidak bergantung pada Pemberi Kerja untuk mendapatkan Penghasilan.,Peraturan Pemerintah Nomor 25 Tahun 2020
"Izin perubahan UUS menjadi Bank Umum Syariah
sebagaimana dimaksud pada ayat (1) diatur dengan
Peraturan Bank Indonesia.",Undang-Undang Nomor 21 Tahun 2008
Jemaah Haji yang membatalkan porsinya dapat mengambil saldo setoran BPIH dan/atau BPIH Khusus dengan mengajukan permohonan pembatalan porsi kepada Menteri atau pejabat yang ditunjuk oleh Menteri.,Peraturan Pemerintah Nomor 5 Tahun 2018
"Penerimaan Perpajakan sebagaimana dimaksud
dalam Pasal 3 huruf a direncanakan sebesar
Rp1.379.991.627.125.000,00 (satu kuadriliun tiga ratus
tujuh puluh sembilan triliun sembilan ratus sembilan
puluh satu miliar enam ratus dua puluh tujuh juta seratus
dua puluh lima ribu rupiah), yang terdiri atas:
a. Pendapatan Pajak Dalam Negeri; dan
b. Pendapatan Pajak Perdagangan Internasional.",Undang-Undang Nomor 27 Tahun 2014
"Anggota-anggota Panitia terdiri atas para ahli dalam persoalan
sumber-sumber pembiayaan.",Peraturan Presiden Nomor 10 Tahun 1964
"Investasi Langsung dimaksudkan untuk mendapatkan manfaat ekonomi, sosial, dan/atau manfaat lainnya.",Peraturan Pemerintah Nomor 1 Tahun 2008
"Format Susunan Bidang Pemerintahan dan Perangkat
Daerah Propinsi, Kabupaten,dan Kota dalam APBD
tercantum dalam Lampiran I Keputusan ini.",Peraturan Menteri Nomor 29 Tahun 2002
Menteri Keuangan melakukan pengawasan dalam rangka pelaksanaan kewenangan supervisi sebagaimana dimaksud dalam Pasal 13 ayat (3).,Peraturan Pemerintah Nomor 8 Tahun 2007
"Program Pengelolaan Subsidi dalam Tahun Anggaran 2015
direncanakan sebesar Rp414.680.552.641.000,00 (empat
ratus empat belas triliun enam ratus delapan puluh miliar
lima ratus lima puluh dua juta enam ratus empat puluh
satu ribu rupiah).",Undang-Undang Nomor 27 Tahun 2014
Denda administratif sebagaimana dimaksud pada poin 4 disetorkan ke BP Tapera bersamaan dengan pembayaran Simpanan bulan berikutnya dan menjadi pendapatan lain BP Tapera.,Peraturan Pemerintah Nomor 25 Tahun 2020
"Klasifikasi Keamanan Arsip Dinamis pada tingkat Biasa
sebagaimana dimaksud dalam Pasal 3 huruf a didasarkan
pertimbangan apabila diketahui oleh Publik tidak memiliki
dampak yang dapat mengganggu kinerja satuan organisasi.",Peraturan Menteri Nomor 1 Tahun 2022
Investasi langsung dalam bentuk penyediaan infrastruktur dan non infrastruktur dilaksanakan dengan cara: a. badan investasi pemerintah melakukan perjanjian investasi dengan badan usaha berdasarkan perjanjian kerjasama. b. badan investasi pemerintah melakukan perjanjian investasi dengan badan yang mengelola dana bergulir pada kementerian teknis berdasarkan perjanjian kerjasama.,Peraturan Pemerintah Nomor 8 Tahun 2007
"Hasil evaluasi Kerja Sama dapat digunakan sebagai dasar
untuk perpanjangan dan pengakhiran Kerja Sama.",Peraturan Menteri Nomor 2 Tahun 2021
"Bagian Kerjasama Bilateral membawahkan:
Subbagian Antar Negara;
Subbagian Organisasi Non-Pemerintah.",Peraturan Menteri Nomor 9 Tahun 2001
"Upaya optimalisasi Piutang Negara sebagaimana dimaksud pada ayat (16), dilakukan terhadap penanggung utang yang: a. kegiatan usahanya melaksanakan pelayanan umum di sektor yang berhubungan dengan kebutuhan dasar masyarakat; b. melaksanakan pelayanan yang mempunyai keterkaitan dengan kepentingan Daerah; dan c. mengalami kesulitan keuangan di dalam memenuhi kewajiban pinjaman sehingga mempengaruhi kelangsungan usahanya.",Peraturan Pemerintah Nomor 8 Tahun 2007
"Pejabat Administrasi adalah Pegawai Aparatur Sipil Negara
yang menduduki Jabatan Administrasi pada instansi
pemerintah.",Peraturan Menteri Nomor 1 Tahun 2022
"Anggaran Belanja Pemerintah Pusat sebagaimana
dimaksud pada ayat (1) termasuk pemberian penghargaan
dan sanksi atas pelaksanaan anggaran belanja
Kementerian Negara/Lembaga tahun 2013 berdasarkan
hasil audit Badan Pemeriksa Keuangan (BPK).",Undang-Undang Nomor 27 Tahun 2014
"Bank dipimpin oleh:
a.Dewan Pembangunan dan
b.Direksi.",Peraturan Pemerintah Pengganti Undang-Undang Nomor 21 Tahun 1960
"Bidang investasi pemerintah yang dapat dibiayai dengan dana investasi sebagaimana dimaksud pada ayat (1), harus menghasilkan manfaat investasi yang terukur bagi pemerintah.",Peraturan Pemerintah Nomor 8 Tahun 2007
"Subbidang Kelembagaan Pendanaan Lingkungan mempunyai tugas melakukan penyiapan bahan
koordinasi, telaahan staf, pengkajian dan evaluasi serta penyusunan rancangan rumusan kebijakan di
bidang kelembagaan pendanaan Lingkungan.",Peraturan Menteri Nomor 9 Tahun 2001
"Pemerintah dapat melakukan pembayaran PMN melebihi
pagu yang ditetapkan dalam Tahun Anggaran 2015 yang
diakibatkan oleh selisih kurs, yang selanjutnya dilaporkan
dalam APBN Perubahan Tahun Anggaran 2015 dan/atau
Laporan Keuangan Pemerintah Pusat (LKPP) Tahun 2015.",Undang-Undang Nomor 27 Tahun 2014
"Pengeluaran pembayaran saldo setoran BPIH Khusus ke PIHK, sebagaimana dimaksud pada ayat (1), dibayarkan setelah dikurangi biaya yang ditetapkan oleh Pemerintah Kerajaan Arab Saudi.",Peraturan Pemerintah Nomor 5 Tahun 2018
"Pelaksanaan penggunaan anggaran sebagaimana
dimaksud pada ayat (1) dan ayat (2) diatur lebih
lanjut oleh Menteri Keuangan paling lambat 14
(empat belas) hari kerja sejak ditetapkannya
Peraturan Presiden ini.",Peraturan Presiden Nomor 31 Tahun 2021
"Lembaga linkage sebagaimana dimaksud pada ayat (1)
merupakan lembaga keuangan bukan bank yang
menjadi mitra kerja Penyalur untuk menyalurkan
pembiayaan ultra mikro melalui pola penyaluran tidak
langsung dengan pembiayaan konvensional dan/ atau
pembiayaan syariah.",Peraturan Menteri Nomor 1 Tahun 2021
Analisis risiko dalam perencanaan kebutuhan investasi disusun berdasarkan prinsip kehati-hatian dan pembagian pengelolaan risiko dalam rangka menjamin efisiensi dan efektivitas pelaksanaan investasi pemerintah.,Peraturan Pemerintah Nomor 8 Tahun 2007
"Pengawas Eksternal sebagaimana dimaksud pada ayat (1)
huruf a berwenang mengakses seluruh Arsip dalam
rangka melaksanakan fungsi pengawasan sesuai dengan
ketentuan peraturan perundang-undangan.",Peraturan Menteri Nomor 1 Tahun 2022
Bank atau Perusahaan Pembiayaan wajib melaporkan pelaksanaan penyaluran pembiayaan perumahan kepada BP Tapera dan Bank Kustodian.,Peraturan Pemerintah Nomor 8 Tahun 2007
"Penyertaan Modal adalah bentuk Investasi Pemerintah pada Badan Usaha dengan mendapat hak kepemilikan, termasuk pendirian Perseroan Terbatas dan/atau pengambilalihan Perseroan Terbatas.",Peraturan Pemerintah Nomor 1 Tahun 2008
"Pelaksanaan tugas dan fungsi Kementerian
Pendidikan, Kebudayaan, Riset, dan Teknologi
menggunakan sumber daya manusia dan anggaran
yang tersedia sesuai tugas dan fungsinya pada
Kementerian Pendidikan dan Kebudayaan.",Peraturan Presiden Nomor 31 Tahun 2021
"Bank dapat mempunyai kantor-kantor cabang kantor-kantor
perwakilan atau koresponden-koresponden di dalam dan di luar negeri
untuk menjalankan tugasnya.",Peraturan Pemerintah Pengganti Undang-Undang Nomor 21 Tahun 1960
Deputi LI mempunyai tugas melaksanakan perumusan kebijakan di bidang sosial ekonomi lingkungan.,Peraturan Menteri Nomor 9 Tahun 2001
"Pengamanan Arsip Dinamis sebagaimana dimaksud dalam
Pasal 10 dikoordinasikan oleh Unit Kearsipan.",Peraturan Menteri Nomor 1 Tahun 2022
"Pemilik/pengusaha alat angkutan lalu-lintas jalan yang melalaikan
kewajibannya membayar sumbangan wajib menurut pasal 2 ayat (1) dan
ayat (2) serta pasal 3 Undang-undang ini dihukum dengan hukuman denda
setinggi-tingginya Rp. 100.000,- (seratus ribu rupiah).",Undang-Undang Nomor 34 Tahun 1964
"Pinjaman dengan persyaratan lunak kepada PT Perusahaan Listrik
Negara (Persero) merupakan pinjaman yang persyaratannya
ditetapkan sebagai berikut:
a. jangka waktu pengembalian pinjaman selama 15 (lima belas)
tahun;
b. masa tenggang pengembalian pinjaman selama 5 (lima) tahun;
dan
c. tingkat suku bunga pinjaman berdasarkan tingkat bunga
Sertifikat Bank Indonesia.",Peraturan Presiden Nomor 9 Tahun 2011
"Mitra Kerja Sama di dalam negeri sebagaimana dimaksud
dalam Pasal 5, meliputi
Kementerian
Lembaga Pemerintah Non-Kementerian
Pemerintah Daerah
Lembaga Pendidikan
Lembaga Swadaya Masyarakat
Dunia Usaha atau
Organisasi Kemasyarakatan.",Peraturan Menteri Nomor 2 Tahun 2021
"Bidang Kawasan Non-Budidaya membawahkan:
Subbidang Keanekaragaman Hayati;
Subbidang Kawasan Lindung.",Peraturan Menteri Nomor 9 Tahun 2001
"Pengeluaran pengembalian setoran BPIH dan/atau BPIH Khusus Jemaah Haji yang membatalkan keberangkatan dengan alasan yang sah, sebagaimana dimaksud dalam Pasal 19 huruf d, terdiri atas: a. Pengembalian setoran awal BPIH dan/atau BPIH Khusus beserta nilai manfaatnya. b. Pengembalian setoran lunas BPIH dan/atau BPIH Khusus beserta nilai manfaatnya.",Peraturan Pemerintah Nomor 5 Tahun 2018
"Bank Syariah dan UUS wajib menerapkan manajemen risiko,
prinsip mengenal nasabah, dan perlindungan nasabah.",Undang-Undang Nomor 21 Tahun 2008
Penunjukan BPS BPIH sebagaimana dimaksud dalam Pasal 10 ayat (3) dan ayat (4) dilakukan melalui proses pemilihan dan penetapan.,Peraturan Pemerintah Nomor 5 Tahun 2018
"Peserta membayar Simpanan kepada Rekening Dana Tapera di Bank Kustodian, melalui Bank Penampung, atau pihak yang menyelenggarakan mekanisme pembayaran lainnya yang ditunjuk oleh Bank Kustodian.",Peraturan Pemerintah Nomor 25 Tahun 2020
"Arsiparis adalah seseorang yang memiliki kompetensi di
bidang kearsipan yang diperoleh melalui pendidikan formal
dan/atau pendidikan dan pelatihan kearsipan serta
mempunyai fungsi, tugas, dan tanggung jawab
melaksanakan kegiatan Kearsipan.",Peraturan Menteri Nomor 1 Tahun 2022
Menteri melakukan pengawasan umum atas jalannya Perusahaan.,Peraturan Pemerintah Nomor 18 Tahun 1983
"Dalam tahapan penandatanganan naskah kesepakatan
Kerja Sama Luar Negeri, Kementerian Koordinator
berkoordinasi dengan Kementerian Luar Negeri.",Peraturan Menteri Nomor 2 Tahun 2021
Kepala daerah menetapkan standar operasional prosedur pelaksanaan Pemberian Insentif dan/atau Pemberian Kemudahan kepada Masyarakat dan/atau Investor.,Peraturan Pemerintah Nomor 8 Tahun 2007
"Kementerian Koordinator adalah Kementerian Koordinator
Bidang Kemaritiman dan Investasi.",Peraturan Menteri Nomor 1 Tahun 2022
"Ketentuan lebih lanjut mengenai besaran tarif
pembiayaan ultra mikro melalui pembiayaan syariah,
jangka waktu pembiayaan, pengembalian pokok 
pembiayaan, pembayaran bagi hasil pembiayaan,
sanksi, peninjauan kembali pembiayaan, jaminan,
tingkat margin di debitur, dan/atau denda diatur dalam
perjanjian antara Badan Layanan Umum Pusat
Investasi Pemerintah pada Kementerian Keuangan
dengan penyalur.",Peraturan Menteri Nomor 1 Tahun 2021
"Pelaksanaan ketentuan sebagaimana dimaksud pada ayat
(1) sampai dengan ayat (6) ditetapkan oleh Pemerintah dan
dilaporkan dalam APBN Perubahan Tahun Anggaran 2015
dan/atau Laporan Keuangan Pemerintah Pusat (LKPP)
Tahun 2015.",Undang-Undang Nomor 27 Tahun 2014
"Pasar Modal adalah kegiatan yang bersangkutan dengan penawaran umum dan perdagangan efek, perusahaan publik yang berkaitan dengan efek yang diterbitkannya, serta lembaga dan profesi yang berkaitan dengan efek.",Peraturan Pemerintah Nomor 8 Tahun 2007
"Bidang Perancangan Hukum Lingkungan 1 membawahkan:
Subbidang Perancangan Internal;
Subbidang Perancangan Eksternal.",Peraturan Menteri Nomor 9 Tahun 2001
"Asisten Deputi 1/III membawahkan:
Bidang Pengkajian Hukum Lingkungan 1;
Bidang Perancangan Hukum Lingkungan 1.",Peraturan Menteri Nomor 9 Tahun 2001
Jemaah Haji adalah Warga Negara Indonesia yang beragama Islam dan telah mendaftarkan diri untuk menunaikan Ibadah Haji sesuai dengan persyaratan yang ditetapkan.,Peraturan Pemerintah Nomor 5 Tahun 2018
"Naskah Kesepakatan Kerja Sama Dalam Negeri, meliputi:
kesepakatan para pihak yang ditulis dalam naskah
kesepahaman bersama atau nama lain dan
kesepakatan para pihak atas pelaksanaan dari naskah
kesepahaman bersama atau nama lain.",Peraturan Menteri Nomor 2 Tahun 2021
Penyelenggaraan kewenangan operasional pengelolaan Investasi Pemerintah oleh Badan Investasi Pemerintah berbentuk satuan kerja sebagaimana dimaksud pada ayat (2) dilaksanakan berdasarkan Peraturan Pemerintah ini.,Peraturan Pemerintah Nomor 1 Tahun 2008
"Presiden atas usul Menteri dapat memberhentikan anggota Direksi sebelum masa jabatan berakhir dalam beberapa hal, antara lain: a. Mutasi jabatan untuk kepentingan Perusahaan dan Negara. b. Permintaan sendiri dari anggota Direksi. c. Melakukan tindakan atau bersikap yang merugikan Perusahaan. d. Melakukan tindakan atau bersikap yang bertentangan dengan kepentingan negara. e. Cacad fisik atau mental yang mengakibatkan tidak dapat melaksanakan tugasnya. f. Meninggal dunia.",Peraturan Pemerintah Nomor 8 Tahun 2007
Gubernur/bupati/walikota menunjuk satuan kerja perangkat daerah yang sesuai dengan bidang tugasnya untuk melaksanakan kewenangan operasional dalam pengelolaan investasi pemerintah daerah.,Peraturan Pemerintah Nomor 8 Tahun 2007
Bank Kustodian wajib menghitung nilai aktiva bersih Dana Tapera pada setiap hari bursa.,Peraturan Pemerintah Nomor 8 Tahun 2007
"Satgas Investasi sebagaimana dimaksud dalam Pasal 1 berada di
bawah dan bertanggungjawab kepada Presiden.",Peraturan Presiden Nomor 11 Tahun 2021
"Badan hukum asing dan/atau warga negara asing dan/atau badan hukum Indonesia
dan/atau warga negara Indonesia dapat menyertakan modal pada perusahaan yang
telah ada yang kegiatannya melakukan penyertaan modal.",Peraturan Menteri Nomor 12 Tahun 1999
Penghapusan Secara Mutlak dilakukan dengan menghapuskan hak tagih Negara/Daerah.,Peraturan Pemerintah Nomor 8 Tahun 2007
"Tahapan pembahasan Kerja Sama sebagaimana dimaksud
dalam Pasal 9 ayat (1) huruf b, merupakan rangkaian
proses kegiatan penelaahan dan pembahasan pokok-pokok
materi Kerja Sama dengan mitra Kerja Sama.",Peraturan Menteri Nomor 2 Tahun 2021
Denda administratif disetorkan ke BP Tapera bersamaan dengan pembayaran Simpanan bulan berikutnya dan menjadi pendapatan lain BP Tapera.,Peraturan Pemerintah Nomor 25 Tahun 2020
Investasi pemerintah yang telah dilaksanakan sebelum Peraturan Pemerintah ini berlaku wajib diadakan penyesuaian dengan ketentuan Peraturan Pemerintah ini dalam waktu paling lambat 12 (dua belas) bulan sejak Peraturan Pemerintah ini berlaku.,Peraturan Pemerintah Nomor 8 Tahun 2007
"Asisten Deputi 1/II membawahkan:
Bidang Sosial;
Bidang Budaya.",Peraturan Menteri Nomor 9 Tahun 2001
"Pertanggungjawaban dan pelaporan, sebagaimana dimaksud dalam Pasal 2 ayat (1), dilaksanakan oleh badan pelaksana.",Peraturan Pemerintah Nomor 5 Tahun 2018
Besaran pembayaran setoran awal ditetapkan oleh Menteri.,Peraturan Pemerintah Nomor 5 Tahun 2018
"Panitia diketuai oleh seorang tenaga ahli dari dalam ataupun dari
luar BAPPENAS.",Peraturan Presiden Nomor 10 Tahun 1964
BP Tapera hanya menunjuk 1 (satu) Bank Kustodian.,Peraturan Pemerintah Nomor 8 Tahun 2007
"Team Penelitian mempunyai tugas mempelajari kemungkinan-kemungkinan serta
menyampaikan saran-saran konkrit untuk :
a. membentuk aparat pengamanan dan pengawasan yang efektif atas pelaksanaan penanaman
modal asing di bidang kehutanan ;
b. menyiapkan langkah-langkah di berbagai bidang yang perlu diambil oleh Pemerintah guna
memanfaatkan sebesar-besarnya penanaman modal asing di bidang kehutanan dalam
rangka pembangunan ekonomi Indonesia.",Peraturan Presiden Nomor 37 Tahun 1970
"Staf Ahli Bidang Ekonomi dan Keuangan mempunyai tugas memberikan
telaahan mengenai masalah ekonomi dan keuangan.",Peraturan Presiden Nomor 176 Tahun 2000
"Dalam menetapkan prioritas kegiatan, sebagaimana dimaksud pada ayat (5), BPKH berkoordinasi dengan Menteri.",Peraturan Pemerintah Nomor 5 Tahun 2018
Bentuk dan isi laporan pengelolaan program sebagaimana dimaksud pada ayat (1) diusulkan oleh BP Tapera setelah berkonsultasi dengan Komite Tapera.,Peraturan Pemerintah Nomor 25 Tahun 2020
"Para anggota Direksi tidak boleh tetap memegang atau
menerima suatu pekerjaan yang tersebut pada ayat (2) huruf b pasal
ini, kecuali jika mendapat ijin dari Dewan Pembangunan.",Peraturan Pemerintah Pengganti Undang-Undang Nomor 21 Tahun 1960
"Pendapatan Daerah adalah semua penerimaan Kas
Daerah dalam periode Tahun Anggaran tertentu yang
menjadi hak Daerah.",Peraturan Menteri Nomor 29 Tahun 2002
"Dewan Pengarah sebagaimana dimaksud dalam Pasal 3
huruf a mempunyai tugas mengoordinasikan
penyelenggaraan kebijakan percepatan pembangunan
kesejahteraan di Provinsi Papua dan Provinsi Papua Barat
untuk mewujudkan masyarakat Provinsi Papua dan
Provinsi Papua Barat yang maju, sejahtera, damai, dan
bermartabat.",Peraturan Presiden Nomor 20 Tahun 2020
Investasi sebagaimana dimaksud pada ayat (1) huruf a meliputi: a. investasi dengan cara pembelian saham; dan/ atau b. investasi dengan cara pembelian surat utang.,Peraturan Pemerintah Nomor 8 Tahun 2007
"Rincian PNBP Tahun Anggaran 2015 sebagaimana
dimaksud pada ayat (2), ayat (3), ayat (5), dan ayat (6)
diatur lebih lanjut dengan Peraturan Presiden yang
ditetapkan paling lambat tanggal 30 November 2014.",Undang-Undang Nomor 27 Tahun 2014
"Dalam laporan sebagaimana dimaksud pada ayat (1)
Pemerintah menyertakan prognosis untuk 6 (enam) bulan
berikutnya.",Undang-Undang Nomor 27 Tahun 2014
"Rekening Induk Dana Investasi adalah rekening pada setiap Badan Investasi Pemerintah berbentuk satuan kerja yang ditetapkan oleh Menteri Keuangan sebagai tempat penyimpanan, penyaluran, dan pengembalian Investasi Pemerintah.",Peraturan Pemerintah Nomor 1 Tahun 2008
"Bank Indonesia dapat menetapkan pengecualian terhadap
kewajiban sebagaimana dimaksud pada ayat (3) bagi Bank
Pembiayaan Rakyat Syariah.",Undang-Undang Nomor 21 Tahun 2008
"Barangsiapa menguasai dana investasi yang pemiliknya ada di
luar Indonesia wajib mengusahakan kuasa yang diperlukan untuk
dapat memenuhi kewajiban-kewajiban yang ditetapkan dalam atau
berdasarkan Peraturan Pemerintah Pengganti Undang-undang ini.",Peraturan Pemerintah Pengganti Undang-Undang Nomor 7 Tahun 1962
"BPKH menetapkan prioritas kegiatan dan besaran penggunaan nilai manfaat DAU, sebagaimana dimaksud pada ayat (4).",Peraturan Pemerintah Nomor 5 Tahun 2018
"Pada saat Peraturan Menteri Koordinator ini mulai berlaku,
Peraturan Menteri Koordinator Bidang Kemaritiman Nomor 13
tahun 2018 tentang Rencana Strategis Kementerian
Koordinator Bidang Kemaritiman Tahun 2015 – 2019 dicabut
dan dinyatakan tidak berlaku.",Peraturan Menteri Nomor 6 Tahun 2020
"Subbidang Daya Tampung Lingkungan Sosial mempunyai tugas melakukan penyusunan bahan
koordinasi, telaahan staf, pengkajian dan evaluasi serta penyusunan rancangan rumusan kebijakan di
bidang daya dukung dan daya tampung Lingkungan sosial.",Peraturan Menteri Nomor 9 Tahun 2001
Menteri Teknis/Pimpinan Lembaga melakukan pengawasan atas pelaksanaan Perjanjian Kerjasama.,Peraturan Pemerintah Nomor 1 Tahun 2008
"Sisa Perhitungan Anggaran Tahun Berkenaan
merupakan selisih lebih dari Surplus/Defisit
ditambah dengan Pos Penerimaan Pembiayaan
dikurangi dengan Pos Pengeluaran Pembiayaan
Daerah.",Peraturan Menteri Nomor 29 Tahun 2002
"Menteri Muda terdiri dari :
1. Menteri Muda Urusan Percepatan Pembangunan Kawasan Timur
Indonesia;
2. Menteri Muda Urusan Restrukturisasi Ekonomi Nasional.",Peraturan Presiden Nomor 176 Tahun 2000
Masyarakat yang telah menerima manfaat dana Fasilitas Likuiditas Pembiayaan Perumahan sebagaimana dimaksud dalam Pasal 64 ayat (2) dapat ditetapkan atau dicatat sebagai Peserta.,Peraturan Pemerintah Nomor 25 Tahun 2020
"Subbidang Dampak dan Tanggap Wilayah mempunyai tugas melakukan penyiapan bahan koordinasi,
telaah staf, pengkajian dan evaluasi penyusunan rancangan rumusan kebijaksanaan antisipasi dampak
dan tanggap perubahan iklim di daerah.",Peraturan Menteri Nomor 9 Tahun 2001
Pengelolaan Tapera dilakukan untuk menjamin tercapainya tujuan Tapera secara efektif dan efisien.,Peraturan Pemerintah Nomor 8 Tahun 2007
Ketentuan Peraturan Pemerintah ini berlaku mutatis mutandis terhadap pengelolaan Investasi Pemerintah Daerah.,Peraturan Pemerintah Nomor 1 Tahun 2008
"Asisten Deputi 3/III membawahkan:
Bidang pengkajian hukum lingkungan 3;
Bidang perancangan hukum Lingkungan 3;",Peraturan Menteri Nomor 9 Tahun 2001
"Subbagian Evaluasi Program mempunyai tugas melakukan penyiapan bahan evaluasi atas pelaksanaan
program pengelolaan lingkungan hidup.",Peraturan Menteri Nomor 9 Tahun 2001
Pembiayaan Panitia dibebankan atas Anggaran BAPPENAS.,Peraturan Presiden Nomor 10 Tahun 1964
