peraturan,sumber
"Pendapatan Pajak Bumi dan Bangunan sebagaimana
dimaksud pada ayat (2) huruf c direncanakan sebesar
Rp26.684.096.175.000,00 (dua puluh enam triliun enam
ratus delapan puluh empat miliar sembilan puluh enam
juta seratus tujuh puluh lima ribu rupiah).",Undang-Undang Nomor 27 Tahun 2014
"Satgas Investasi melaporkan pelaksanaan tugasnya kepada
Presiden paling sedikit 1 (satu) kali dalam 1 (satu) bulan atau
sewaktu-waktu jika diperlukan.",Peraturan Presiden Nomor 11 Tahun 2021
"Tata cara Penghapusan Secara Bersyarat dan Penghapusan Secara Mutlak atas piutang Perusahaan Negara/Daerah yang pengurusan piutangnya diserahkan kepada PUPN, diatur lebih lanjut dengan Peraturan Menteri Keuangan.",Peraturan Pemerintah Nomor 14 Tahun 2005
Rancangan rencana kerja dan anggaran tahunan pengelolaan Keuangan Haji sebagaimana dimaksud pada ayat (1) disusun untuk jangka waktu 1 (satu) tahun.,Peraturan Pemerintah Nomor 5 Tahun 2018
Badan pelaksana menindaklanjuti hasil pengawasan sebagaimana dimaksud pada ayat (1).,Peraturan Pemerintah Nomor 5 Tahun 2018
Pengeluaran untuk belanja operasional kantor sebagaimana dimaksud dalam Pasal 22 huruf b terdiri atas belanja barang dan belanja modal.,Peraturan Pemerintah Nomor 5 Tahun 2018
"Investasi Pemerintah adalah penempatan sejumlah dana dan/atau barang oleh pemerintah pusat dalam jangka panjang untuk investasi pembelian surat berharga dan investasi langsung, yang mampu mengembalikan nilai pokok ditambah dengan manfaat ekonomi, sosial, dan/atau manfaat lainnya dalam jangka waktu tertentu.",Peraturan Pemerintah Nomor 8 Tahun 2007
"Mengambil langkah-langkah yang diperlukan sesuai
dengan tugas, fungsi, dan kewenangan masing-masing
secara terkoordinasi dan terintegrasi untuk melakukan
peningkatan daya saing nasional dan melakukan
persiapan pelaksanaan Masyarakat Ekonomi ASEAN yang
akan dimulai pada Tahun 2015.",Peraturan Presiden Nomor 6 Tahun 2014
Dana Fasilitas Likuiditas Pembiayaan Perumahan sebagaimana dimaksud pada ayat (1) sewaktu-waktu dapat ditarik kembali oleh Pemerintah.,Peraturan Pemerintah Nomor 25 Tahun 2020
Pemupukan Dana Tapera sebagaimana dimaksud pada ayat (1) diadministrasikan oleh Bank Kustodian badan usaha milik negara atau yang terafiliasi.,Peraturan Pemerintah Nomor 25 Tahun 2020
Sumber dana Investasi Pemerintah dapat berasal dari: a. Anggaran Pendapatan dan Belanja Negara; b. keuntungan investasi terdahulu; c. dana/barang amanat pihak lain yang dikelola oleh Badan Investasi Pemerintah; dan/atau d. sumber-sumber lainnya yang sah.,Peraturan Pemerintah Nomor 1 Tahun 2008
"Unit Tata Usaha Perbantuan mempunyai tugas memberikan pelayanan administratif kepada Meneg-LH,
Sesmen, para Deputi, dan kelompok Staf Ahli.",Peraturan Menteri Nomor 9 Tahun 2001
"Dalam hal perselisihan sebagaimana dimaksud pada ayat (1)
melibatkan Mitra Kerja Sama Dalam Negeri, kedua belah
pihak dapat memilih mekanisme penyelesaian yang
disepakati bersama sesuai dengan peraturan perundangan-
undangan.",Peraturan Menteri Nomor 2 Tahun 2021
Dana titipan Jemaah Haji sebagaimana dimaksud pada ayat (1) merupakan dana yang tidak dicatat dalam anggaran pendapatan dan belanja negara.,Peraturan Pemerintah Nomor 5 Tahun 2018
"Staf Ahli Bidang Pengembangan Kerja Sama Ekonomi Internasional
mempunyai tugas memberikan telaahan mengenai masalah
pengembangan kerja sama ekonomi internasional.",Peraturan Presiden Nomor 176 Tahun 2000
Direktur Utama untuk dan atas nama Direksi menerima petunjuk-petunjuk dari dan bertanggung jawab kepada Menteri tentang kebijaksanaan umum untuk menjalankan tugas-tugas pokok Perusahaan dan hal-hal lain yang dianggap perlu.,Peraturan Pemerintah Nomor 18 Tahun 1983
Pemupukan Dana Tapera dilakukan oleh Manajer Investasi dalam bentuk KIK yang portofolio investasinya ditempatkan pada instrumen investasi dalam negeri.,Peraturan Pemerintah Nomor 25 Tahun 2020
"""Menteri"" ialah Menteri Urusan Pendapatan, Pembiayaan dan
Pengawasan.",Undang-Undang Nomor 34 Tahun 1964
"Struktur APBD sebagaimana dimaksud dalam Pasal 2
Ayat diklasifikasikan berdasarkan bidang Pemerintahan
Daerah berdasarkan peraturan perundang-undangan.",Peraturan Menteri Nomor 29 Tahun 2002
Penghapusan Secara Bersyarat dilakukan dengan menghapuskan Piutang Negara/Daerah dari pembukuan Pemerintah Pusat/Daerah tanpa menghapuskan hak tagih Negara/Daerah.,Peraturan Pemerintah Nomor 8 Tahun 2007
"Asisten Deputi 1/II mempunyai tugas melaksanakan penyusunan telaahan staf, pengkajian, dan evaluasi, serta
penyiapan rancangan rumusan kebijakan sosial budaya Lingkungan.",Peraturan Menteri Nomor 9 Tahun 2001
"Dalam hal terjadi Penggabungan atau Peleburan Bank
Syariah dengan Bank lainnya, Bank hasil Penggabungan
atau Peleburan tersebut wajib menjadi Bank Syariah.",Undang-Undang Nomor 21 Tahun 2008
"Pengamanan Arsip Dinamis dilakukan oleh Pejabat
Fungsional Arsiparis di Unit Pengolah dan di Unit
Kearsipan.",Peraturan Menteri Nomor 1 Tahun 2022
"Bidang Perdagangan dan Investasi Ramah Lingkungan mempunyai tugas melaksanakan koordinasi,
penyusunan telaahan staf, pengkajian dan evaluasi serta penyusunan rancangan rumusan kebijakan
perdagangan dalam negeri dan investasi ramah lingkungan.",Peraturan Menteri Nomor 9 Tahun 2001
"Salinan naskah asli Credit Guarantee and Investment
Facility Articles of Agreement (Pasal Persetujuan Fasilitas
Penjaminan Kredit dan Investasi) dalam bahasa Inggris
dan terjemahannya dalam bahasa Indonesia
sebagaimana terlampir dan merupakan bagian tidak
terpisahkan dari Peraturan Presiden ini.",Peraturan Presiden Nomor 23 Tahun 2017
Menteri melakukan pembinaan dan pengawasan pelaksanaan Pemberian Insentif dan/atau Pemberian Kemudahan kepada Masyarakat dan/atau Investor yang dilakukan oleh gubernur berkoordinasi dengan instansi terkait sesuai dengan ketentuan peraturan perundang-undangan.,Peraturan Pemerintah Nomor 8 Tahun 2007
Kepala/direktur Badan Investasi Pemerintah wajib melakukan Divestasi surat berharga sesuai dengan masa waktu yang telah ditentukan tidak memerlukan persetujuan Menteri Keuangan.,Peraturan Pemerintah Nomor 1 Tahun 2008
"Dalam tahapan penjajakan, Menteri Koordinator atau
Pejabat Pimpinan Tinggi Madya dapat melakukan inisiasi
Kerja Sama.",Peraturan Menteri Nomor 2 Tahun 2021
"Dengan tidak mengurangi ketentuan-ketentuan dalam Peraturan Pemerintah ini, terhadap perusahaan berlaku hukum Indonesia.",Peraturan Pemerintah Nomor 8 Tahun 2007
"Dewan Pengawas Syariah sebagaimana dimaksud pada ayat
(1) bertugas memberikan nasihat dan saran kepada direksi
serta mengawasi kegiatan Bank agar sesuai dengan Prinsip
Syariah.",Undang-Undang Nomor 21 Tahun 2008
"Bidang Perancangan Hukum Lingkungan 2 mempunyai tugas dalam menyelenggarakan perancangan dan
perumusan kebijakan hukum lingkungan yang berkait dengan peraturan perundang-undangan pusat dan
daerah.",Peraturan Menteri Nomor 9 Tahun 2001
Modal Perusahaan adalah kekayaan negara yang dipisahkan dari Anggaran Pendapatan dan Belanja Negara dan tidak terbagi atas saham-saham.,Peraturan Pemerintah Nomor 8 Tahun 2007
"Asisten Deputi 3/I membawahkan:
Bidang Atmosfer;
Bidang Antisipasi Perubahan Iklim.",Peraturan Menteri Nomor 9 Tahun 2001
Menteri adalah menteri yang menyelenggarakan urusan pemerintahan di bidang agama.,Peraturan Pemerintah Nomor 5 Tahun 2018
"Subbagian Tata Usaha Kepegawaian mempunyai tugas melakukan urusan administrasi kepegawaian,
pengelolaan dan pendokumentasian data kepegawaian, kepangkatan dan penggajian, serta penyiapan
DP3, Askes, Kartu Pegawai, Tanda Pengenal Pegawai, Sumpah PNS, Cuti, penghargaan;",Peraturan Menteri Nomor 9 Tahun 2001
"Subbagian Perjalanan mempunyai tugas melakukan urusan administrasi perjalanan dinas baik di dalam
maupun ke luar negeri, pengurusan visa dan paspor.",Peraturan Menteri Nomor 9 Tahun 2001
"Peserta yang status kepesertaan Tapera nonaktif sebagaimana dimaksud pada ayat (1), rekening kepesertaannya tetap tercatat di BP Tapera.",Peraturan Pemerintah Nomor 8 Tahun 2007
"Deputi Bidang Restrukturisasi Perusahaan mempunyai tugas
melaksanakan perumusan kebijakan di bidang restrukturisasi perusahaan.",Peraturan Presiden Nomor 176 Tahun 2000
"Pengeluaran kegiatan untuk kemaslahatan umat Islam, sebagaimana dimaksud dalam Pasal 19 huruf g, pendanaannya berasal dari nilai manfaat DAU.",Peraturan Pemerintah Nomor 5 Tahun 2018
Pekerja sebagaimana dimaksud pada ayat (1) dan Pekerja Mandiri sebagaimana dimaksud pada ayat (2) dapat memilih prinsip pengelolaan Tapera sesuai dengan prinsip konvensional atau prinsip syariah.,Peraturan Pemerintah Nomor 8 Tahun 2007
"Dalam melaksanakan tugas, setiap pejabat pimpinan dibantu oleh pejabat pimpinan bawahannya dan dalam
rangka pemberian bimbingan kepada bawahannya, wajib mengadakan rapat berkala.",Peraturan Menteri Nomor 9 Tahun 2001
"Membentuk sebuah PANITIA NEGARA BAPPENAS URUSAN SUMBER-SUMBER
PEMBIAYAAN di dalam lingkungan BAPPENAS yang bertanggung jawab kepada
Pimpinan BAPPENAS dan selanjutnya dalam Peraturan ini disebut
Panitia.",Peraturan Presiden Nomor 10 Tahun 1964
Dana Cadangan sebagaimana dimaksud pada ayat (1) merupakan dana pada Rekening Dana Tapera yang dipergunakan untuk membayar Simpanan Peserta yang telah berakhir kepesertaannya.,Peraturan Pemerintah Nomor 25 Tahun 2020
"Bank Konvensional hanya dapat mengubah kegiatan
usahanya berdasarkan Prinsip Syariah dengan izin Bank
Indonesia.",Undang-Undang Nomor 21 Tahun 2008
Investasi pemerintah dilakukan dalam bentuk: a. investasi surat berharga; dan/ atau b. investasi langsung.,Peraturan Pemerintah Nomor 8 Tahun 2007
"DAU sebagaimana dimaksud pada ayat (1) huruf b
dialokasikan sebesar 27,7% (dua puluh tujuh koma tujuh
persen) dari Pendapatan Dalam Negeri (PDN) neto atau
direncanakan sebesar Rp352.887.848.528.000,00 (tiga
ratus lima puluh dua triliun delapan ratus delapan puluh
tujuh miliar delapan ratus empat puluh delapan juta lima
ratus dua puluh delapan ribu rupiah).",Undang-Undang Nomor 27 Tahun 2014
"Ketentuan mengenai perkiraan defisit melampaui target
serta penggunaan dana SAL, penarikan pinjaman siaga,
dan/atau penerbitan SBN sebagai tambahan pembiayaan
sebagaimana dimaksud pada ayat (1) diatur lebih lanjut
dengan Peraturan Menteri Keuangan.",Undang-Undang Nomor 27 Tahun 2014
"Investasi dari Dana, diatur oleh Menteri.",Undang-Undang Nomor 34 Tahun 1964
"Hasil pemantauan Kerja Sama dapat digunakan sebagai
bahan untuk melakukan evaluasi terhadap pelaksanaan
Kerja Sama.",Peraturan Menteri Nomor 2 Tahun 2021
"Dalam melaksanakan tugas sebagaimana dimaksud pada pasal 12, Bagian Kepegawaian menyelenggarakan
fungsi:
pengelolaan tata usaha kepegawaian;
pengelolaan administrasi pengangkatan, pemberhentian, dan pemensiunan;
pengelolaan pengembangan pegawai.",Peraturan Menteri Nomor 9 Tahun 2001
"Laporan sebagaimana dimaksud pada ayat (1) dan ayat (2)
disampaikan kepada Dewan Perwakilan Rakyat paling
lambat pada akhir bulan Juli 2015, untuk dibahas
bersama antara Dewan Perwakilan Rakyat dan
Pemerintah.",Undang-Undang Nomor 27 Tahun 2014
"Dalam hal Piutang Negara yang berasal dari penerusan Pinjaman Luar Negeri/Rekening Dana Investasi/Rekening Pembangunan Daerah akan dilakukan penghapusan sebagaimana dimaksud dalam Pasal 14, Menteri Keuangan terlebih dahulu melakukan upaya optimalisasi tingkat penyelesaian Piutang Negara dimaksud.",Peraturan Pemerintah Nomor 14 Tahun 2005
"Uji kemampuan dan kepatutan terhadap komisaris dan
direksi yang melanggar integritas dan tidak memenuhi
kompetensi dilakukan oleh Bank Indonesia.",Undang-Undang Nomor 21 Tahun 2008
Pekerja Mandiri sebagaimana dimaksud pada ayat (2) huruf b yang berpenghasilan di bawah Upah minimum dapat menjadi Peserta.,Peraturan Pemerintah Nomor 25 Tahun 2020
"Ketentuan mengenai syarat, jumlah, tugas, kewenangan,
tanggung jawab, serta hal lain yang menyangkut dewan komisaris
dan direksi Bank Syariah diatur dalam anggaran dasar Bank

Syariah sesuai dengan ketentuan peraturan perundang-
undangan.",Undang-Undang Nomor 21 Tahun 2008
Tingkat hasil pemupukan Dana Tapera sebagaimana dimaksud pada ayat (1) sudah mempertimbangkan komponen biaya pengelolaan pemupukan Dana Tapera.,Peraturan Pemerintah Nomor 25 Tahun 2020
"Dalam melaksanakan tugas sebagaimana dimaksud dalam Pasal 77, Bidang Atmosfer mempunyai fungsi:
penyiapan bahan rumusan kebijakan pengelolaan atmosfer;
penyusunan bahan rancangan rumusan sasaran pengelolaan atmosfer;
pelaksanaan koordinasi penyusunan telaah staf dan pengkajian pengelolaan atmosfer;
pemantauan dan evaluasi pelaksanaan kebijakan pengelolaan atmosfer.",Peraturan Menteri Nomor 9 Tahun 2001
"Pelaksanaan tugas dan fungsi Kementerian Investasi/
Badan Koordinasi Penanaman Modal sebagaimana
dimaksud dalam Pasal 2 menggunakan sumber daya
manusia dan anggaran yang tersedia pada Badan
Koordinasi Penanaman Modal.",Peraturan Presiden Nomor 31 Tahun 2021
"Jumlah bunga, denda dan biaya administrasi
pinjaman yang akan dibayar pada tahun berkenaan
dianggarkan pada Bagian, Kelompok Belanja, Jenis
Belanja Administrasi Umum, Obyek Bunga dan
Denda, dan Rincian Obyek Bunga dan Denda
Pinjaman. BAB III, PENYUSUNAN APBD Bagian
Pertama Arah, Kebijakan Umum, Strategi dan
Prioritas APBD",Peraturan Menteri Nomor 29 Tahun 2002
"Subbagian Akuntansi dan Verifikasi mempunyai tugas melakukan akuntansi dan verifikasi pelaksanaan
anggaran.",Peraturan Menteri Nomor 9 Tahun 2001
"Hasil analisis sebagaimana dimaksud pada ayat (2),
dilaporkan kepada Menteri Koordinator untuk
mendapatkan persetujuan.",Peraturan Menteri Nomor 2 Tahun 2021
"Anggaran Belanja Pemerintah Pusat sebagaimana
dimaksud pada ayat (1) termasuk program pengelolaan
hibah negara sebesar Rp3.565.119.580.000,00 (tiga triliun
lima ratus enam puluh lima miliar seratus sembilan belas
juta lima ratus delapan puluh ribu rupiah) yang
diterushibahkan ke daerah.",Undang-Undang Nomor 27 Tahun 2014
"Sesmen mempunyai tugas membantu Meneg LH dalam melaksanakan pembinaan dan koordinasi perumusan
kebijaksanaan Meneg LH dan menyelenggarakan pengelolaan dan pelayanan administrasi kepada seluruh
unsur di lingkungan Kantor Meneg LH.v",Peraturan Menteri Nomor 9 Tahun 2001
"Besarnya modal disetor minimum untuk mendirikan Bank
Syariah ditetapkan dalam Peraturan Bank Indonesia.",Undang-Undang Nomor 21 Tahun 2008
"Menteri Muda Urusan Restrukturisasi Ekonomi Nasional terdiri dari :
a. Menteri Muda;
b. Deputi Bidang Restrukturisasi Kebijakan Sektor Riil;
c. Deputi Bidang Restrukturisasi Perusahaan;
d. Deputi Bidang Kelembagaan, Hukum, dan Regulasi;
e. Staf Ahli Bidang Pengembangan Ekonomi Makro dan Keuangan;
f. Staf Ahli Bidang Pengembangan Kerja Sama Ekonomi Internasional;
g. Staf Ahli Bidang Pengembangan Sektor Usaha Kecil Menengah.",Peraturan Presiden Nomor 176 Tahun 2000
"Tata-tertib dan cara menjalankan pekerjaan Direksi diatur
dalam suatu peraturan yang ditetapkan oleh Direksi.",Peraturan Pemerintah Pengganti Undang-Undang Nomor 21 Tahun 1960
Perencanaan sebagaimana dimaksud dalam Pasal 2 ayat (1) meliputi: a. perumusan kebijakan; b. penyiapan rencana strategis; dan c. penyiapan rencana kerja dan anggaran tahunan.,Peraturan Pemerintah Nomor 5 Tahun 2018
Pemupukan Dana Tapera dilakukan sesuai dengan kebijakan investasi yang ditetapkan oleh komite investasi KIK dan dituangkan dalam KIK.,Peraturan Pemerintah Nomor 8 Tahun 2007
"Pemerintah dapat memberikan hibah kepada
Pemerintah/Lembaga asing dan menetapkan
Pemerintah/Lembaga asing penerima untuk tujuan
kemanusiaan.",Undang-Undang Nomor 27 Tahun 2014
"PNBP sebagaimana dimaksud dalam Pasal 3 huruf b
direncanakan sebesar Rp410.340.976.934.000,00 (empat
ratus sepuluh triliun tiga ratus empat puluh miliar
sembilan ratus tujuh puluh enam juta sembilan ratus tiga
puluh empat ribu rupiah), yang terdiri atas:
a. penerimaan sumber daya alam;
b. pendapatan bagian laba BUMN;
c. PNBP lainnya; dan
d. pendapatan BLU.",Undang-Undang Nomor 27 Tahun 2014
Anggota Direksi adalah Warga Negara Republik Indonesia.,Peraturan Pemerintah Nomor 18 Tahun 1983
"Penyelenggaraan Ibadah Haji Khusus adalah Penyelenggaraan Ibadah Haji yang dilaksanakan oleh penyelenggara ibadah haji khusus dengan pengelolaan, pembiayaan, dan pelayanannya bersifat khusus.",Peraturan Pemerintah Nomor 5 Tahun 2018
"Pengeluaran obligasi atau alat-alat yang sah lainnya sebagaimana dimaksud dalam ayat (1) Pasal ini, termasuk ketentuan-ketentuan yang berhubungan dengan itu diatur dengan Peraturan Pemerintah.",Peraturan Pemerintah Nomor 8 Tahun 2007
Ketentuan lebih lanjut mengenai laporan atas pelaksanaan kegiatan investasi sebagaimana dimaksud pada ayat (60) diatur dalam Peraturan Menteri Keuangan.,Peraturan Pemerintah Nomor 1 Tahun 2008
"Ketua Komite Pengarah sekaligus duduk sebagai Co-Chair dalam
Joint Steering Committee yang dibentuk oleh Pemerintah Republik
Indonesia dan Pemerintah Republik Singapura.",Peraturan Presiden Nomor 12 Tahun 2006
"Setiap kelompok Pendapatan dirinci menurut Jenis
pendapatan. Setiap Jenis Pendapatan dirinci
menurut, Obyek Pendapatan. Setiap,Obyek
Pendapatan dirinci menurut Rincian Obyek
Pendapatan.",Peraturan Menteri Nomor 29 Tahun 2002
Unit penyertaan investasi sebagaimana dimaksud pada ayat (1) merupakan satuan ukuran yang menunjukkan kepentingan setiap Peserta.,Peraturan Pemerintah Nomor 25 Tahun 2020
"Laporan keuangan badan investasi pemerintah yang telah diaudit disampaikan kepada Menteri Keuangan setiap tahun anggaran selambat-lambatnya 5 (lima) bulan setelah tahun anggaran berakhir, sebagai bahan penyusunan Laporan Keuangan Pemerintah Pusat.",Peraturan Pemerintah Nomor 8 Tahun 2007
"Dalam melaksanakan tugas sebagaimana dimaksud dalam Pasal 25, Bagian Rumah Tangga menyelenggarakan
fungsi:
pengelolaan pengadaan alat tulis dan perlengkapan kantor;
pengelolaan kegiatan penggunaan dan pemeliharaan gedung, peralatan dan kendaraan;
pelaksanaan urusan keprotokolan.",Peraturan Menteri Nomor 9 Tahun 2001
Piutang Daerah yang akan dihapuskan secara mutlak sebagaimana dimaksud dalam Pasal 10 diusulkan oleh Pejabat Pengelola Keuangan Daerah yang berpiutang kepada Gubernur/Walikota/Bupati setelah mendapat pertimbangan dari Kantor Wilayah Direktorat Jenderal Piutang dan Lelang Negara yang wilayah kerjanya meliputi wilayah kerja Gubernur/Walikota/Bupati yang bersangkutan.,Peraturan Pemerintah Nomor 14 Tahun 2005
Pemerintah dapat memberikan dukungan finansial dan/atau dukungan lainnya atas pelaksanaan investasi pemerintah dalam penyediaan infrastruktur dan non infrastruktur yang dikerjasamakan dengan badan usaha.,Peraturan Pemerintah Nomor 8 Tahun 2007
"Perbankan Syariah dalam melakukan kegiatan usahanya
berasaskan Prinsip Syariah, demokrasi ekonomi, dan prinsip
kehati-hatian.",Undang-Undang Nomor 21 Tahun 2008
"Bank adalah badan usaha yang menghimpun dana dari masyarakat termasuk dari BP Tapera dalam bentuk Simpanan dan menyalurkannya kepada masyarakat dalam bentuk kredit dan/atau bentuk lainnya dalam rangka meningkatkan taraf hidup rakyat, khususnya dalam pemenuhan kebutuhan perumahan.",Peraturan Pemerintah Nomor 8 Tahun 2007
"Dalam hal Dewan Pengawas pada Badan Investasi Pemerintah berbentuk satuan kerja belum dibentuk, wewenang dan tanggung jawab Dewan Pengawas dilaksanakan oleh Komite Investasi Pemerintah.",Peraturan Pemerintah Nomor 1 Tahun 2008
Penghapusan Secara Bersyarat dan Penghapusan Secara Mutlak atas piutang Perusahaan Negara/Daerah dilakukan sesuai dengan ketentuan peraturan perundang-undangan yang berlaku.,Peraturan Pemerintah Nomor 8 Tahun 2007
"Sanksi pembekuan izin usaha Pemberi Kerja dikenakan apabila setelah pengenaan sanksi memublikasikan ketidakpatuhan Pemberi Kerja sebagaimana dimaksud pada poin 6, Pemberi Kerja tidak melaksanakan kewajibannya.",Peraturan Pemerintah Nomor 25 Tahun 2020
"Tim Pelaksana sebagaimana dimaksud dalam Pasal 3
huruf b mempunyai tugas menyelenggarakan kebijakan
percepatan pembangunan kesejahteraan di Provinsi
Papua dan Provinsi Papua Barat untuk mewujudkan
masyarakat Provinsi Papua dan Provinsi Papua Baratyang
maju, sejahtera, damai, dan bermartabat.",Peraturan Presiden Nomor 20 Tahun 2020
Perusahaan melakukan usaha-usahanya berdasarkan ketentuan-ketentuan dalam Peraturan Pemerintah ini dan peraturan perundang-undangan lainnya.,Peraturan Pemerintah Nomor 8 Tahun 2007
"Ketua Kelompok Kerja sebagaimana dimaksud dalam Diktum
KEEMPAT huruf a, sekaligus duduk sebagai Co-Chair dalam Joint
Working Group yang dibentuk oleh Pemerintah Republik Indonesia
dan Pemerintah Republik Singapura.",Peraturan Presiden Nomor 12 Tahun 2006
"Dalam menyalurkan Pembiayaan dan melakukan kegiatan usaha
lainnya, Bank Syariah dan UUS wajib menempuh cara-cara yang
tidak merugikan Bank Syariah dan/atau UUS dan kepentingan
Nasabah yang mempercayakan dananya.",Undang-Undang Nomor 21 Tahun 2008
"Bidang Sosial mempunyai tugas melaksanakan koordinasi penyusunan telaahan staf, pengkajian dan evaluasi,
serta penyusunan rancangan rumusan kebijaksanaan aspek sosial lingkungan.",Peraturan Menteri Nomor 9 Tahun 2001
"Dengan mengindahkan asas-asas ekonomi serta terjaminnya keselamatan kekayaan negara, Perusahaan mengusahakan pengerukan alur-alur pelayaran, kolam-kolam pelabuhan dan pengerukan serta reklamasi untuk pembangunan lainnya dengan menggunakan sarana dan fasilitas baik yang dimilikinya maupun milik pihak ketiga.",Peraturan Pemerintah Nomor 8 Tahun 2007
"Badan Investasi Pemerintah adalah unit pelaksana investasi sebagai satuan kerja yang mempunyai tugas dan tanggung jawab pelaksanaan Investasi Pemerintah atau badan hukum yang lingkup kegiatannya di bidang pelaksanaan Investasi Pemerintah, berdasarkan kebijakan yang ditetapkan oleh Menteri Keuangan.",Peraturan Pemerintah Nomor 1 Tahun 2008
"Bidang Sistem Pendanaan Lingkungan mempunyai tugas melaksanakan koordinasi, penyusunan telaahan staf,
pengkajian dan evaluasi serta penyusunan rancangan rumusan kebijakan sistem pendanaan lingkungan.",Peraturan Menteri Nomor 9 Tahun 2001
"Dalam melaksanakan tugas sebagaimana dimaksud dalam Pasal 21, Bagian Keuangan menyelenggarakan
fungsi:
penyusunan anggaran;
pelaksanaan urusan perbendaharaan;
pengelolaan urusan akuntansi dan verifikasi.",Peraturan Menteri Nomor 9 Tahun 2001
"Simpanan Peserta terbagi dalam alokasi dana pemupukan, dana pemanfaatan, dan dana cadangan dengan komposisi persentase tertentu yang ditetapkan oleh BP Tapera.",Peraturan Pemerintah Nomor 8 Tahun 2007
Menteri Teknis/Pimpinan Lembaga bertanggung jawab kepada Presiden atas pelaksanaan kebijakan Investasi Langsung dalam penyediaan infrastruktur dan bidang lainnya yang berada dalam penguasaannya.,Peraturan Pemerintah Nomor 1 Tahun 2008
"Bank Kustodian yang melanggar ketentuan sebagaimana dimaksud dalam Pasal 19 ayat (2), Pasal 19 ayat (3), dan Pasal 52 ayat (1) dikenai sanksi administratif berupa peringatan tertulis.",Peraturan Pemerintah Nomor 8 Tahun 2007
Kas Haji adalah rekening Badan Pengelola Keuangan Haji pada bank umum syariah dan/atau unit usaha syariah yang digunakan untuk menampung Dana Haji.,Peraturan Pemerintah Nomor 5 Tahun 2018
Pemberian dukungan pemerintah sebagaimana dimaksud pada ayat (1) dilaksanakan melalui skema pembagian risiko yang harus ditanggung oleh pemerintah dan badan usaha.,Peraturan Pemerintah Nomor 8 Tahun 2007
"Dalam menyelenggarakan tugas sebagaimana dimaksud dalam Pasal 133, Bidang Perancangan Hukum
Lingkungan 1 menyelenggarakan fungsi:
penyiapan bahan perancangan dan perumusan kebijakan hukum Lingkungan;
pelaksanaan koordinasi perancangan dan perumusan sasaran kebijakan hukum Lingkungan;
pelaksanaan diseminasi hukum lingkungan.",Peraturan Menteri Nomor 9 Tahun 2001
"Pengawasan sebagaimana dimaksud pada ayat (79), ayat (80), dan ayat (81) meliputi pemantauan/monitoring, evaluasi, dan pengendalian.",Peraturan Pemerintah Nomor 8 Tahun 2007
Skema pembiayaan perumahan sebagaimana dimaksud pada ayat (1) ditetapkan dengan memperhatikan kebijakan di bidang perumahan dan kawasan permukiman.,Peraturan Pemerintah Nomor 8 Tahun 2007
"Menteri Urusan Pendapatan, Pembiayaan dan Pengawasan serta
Menteri Urusan Bank Sentral bersama-sama menetapkan
peraturan tentang pengeluaran dan penggunaan kertas
perbendaharaan Negara, jika perlu dengan menyimpang dari
ketentuan-ketentuan perundang-undangan yang telah ada.",Peraturan Pemerintah Pengganti Undang-Undang Nomor 7 Tahun 1962
"a. Tahun Buku Bank adalah tahun takwim.
b. Dalam hal tata-usaha Bank diselenggarakan oleh badan
lain, maka Bank mengikuti tahun buku badan tersebut.",Peraturan Pemerintah Pengganti Undang-Undang Nomor 21 Tahun 1960
Perumusan kebijakan pengelolaan Keuangan Haji sebagaimana dimaksud dalam Pasal 3 huruf a didasarkan pada: a. kemampuan Keuangan Haji; b. perkembangan ekonomi; dan c. hasil pemantauan dan evaluasi Penyelenggaraan Ibadah Haji.,Peraturan Pemerintah Nomor 5 Tahun 2018
"Perusahaan adalah badan hukum yang diserahi tugas dan kewajiban untuk menyelenggarakan usaha pengerukan alur-alur pelayaran, kolam-kolam pelabuhan, dan reklamasi serta pekerjaan pengerukan lainnya.",Peraturan Pemerintah Nomor 18 Tahun 1983
Peserta Pekerja Mandiri wajib membayar Simpanan paling lambat tanggal 10 (sepuluh) setiap bulan.,Peraturan Pemerintah Nomor 8 Tahun 2007
Laporan keuangan badan investasi pemerintah yang belum diaudit disampaikan kepada Menteri Keuangan setiap tahun anggaran selambat-lambatnya 2 (dua) bulan setelah tahun anggaran berakhir.,Peraturan Pemerintah Nomor 8 Tahun 2007
"Perencanaan kebutuhan investasi pemerintah dalam pembelian surat berharga yang diusulkan badan investasi pemerintah sebagaimana dimaksud dalam Pasal 16 ayat (4), paling sedikit harus memuat: a. analisis fisiko dan kelayakan rencana investasi pembelian surat berharga; dan b. hasil penilaian penasihat investasi atas kewajaran pembelian surat berharga.",Peraturan Pemerintah Nomor 8 Tahun 2007
"Anggaran Pendidikan direncanakan sebesar
Rp409.131.707.077.000,00 (empat ratus sembilan triliun
seratus tiga puluh satu miliar tujuh ratus tujuh juta tujuh
puluh tujuh ribu rupiah).",Undang-Undang Nomor 27 Tahun 2014
