peraturan,sumber
"Segala biaya yang diperlukan dalam rangka pelaksanaan Keputusan
Presiden ini, dibebankan kepada Anggaran Pendapatan dan Belanja
Negara.",Peraturan Presiden Nomor 12 Tahun 2006
Investasi dalam bentuk emas sebagaimana dimaksud pada ayat (1) paling banyak 5% (lima persen) dari total penempatan dan/atau investasi Keuangan Haji.,Peraturan Pemerintah Nomor 5 Tahun 2018
Warga negara yang telah memiliki rekening tabungan haji sebagaimana dimaksud pada ayat (1) membayar setoran awal BPIH dan/atau BPIH Khusus sesuai dengan jumlah yang telah ditetapkan sebagaimana dimaksud dalam Pasal 10 ayat (5).,Peraturan Pemerintah Nomor 5 Tahun 2018
"Lingkup pengelolaan Investasi Pemerintah meliputi perencanaan, pelaksanaan investasi, penatausahaan dan pertanggungjawaban investasi, pengawasan, dan divestasi.",Peraturan Pemerintah Nomor 1 Tahun 2008
"Apabila tanggal 10 (sepuluh) sebagaimana dimaksud pada ayat (2) jatuh pada hari libur, Simpanan dibayarkan pada hari kerja pertama setelah hari libur tersebut.",Peraturan Pemerintah Nomor 8 Tahun 2007
"Dalam rangka penyelenggaraan hal sebagaimana dimaksud dalam ayat (1) pasal ini, Menteri menetapkan lebih lanjut kewenangan Direktur Jenderal yang bersangkutan sesuai dengan bidang kegiatannya untuk melakukan pembinaan teknis terhadap Perusahaan.",Peraturan Pemerintah Nomor 8 Tahun 2007
"Pemimpin Kantor cabang, Kantor Perwakilan Koresponden-
koresponden, semua pejabat serta pegawai-pegawai Bank lainnya
diangkat dan diperhentikan oleh Direksi.",Peraturan Pemerintah Pengganti Undang-Undang Nomor 21 Tahun 1960
Penunjukan satuan kerja perangkat daerah sebagaimana dimaksud pada ayat (91) dilakukan dengan mempertimbangkan ketentuan mengenai organisasi perangkat daerah.,Peraturan Pemerintah Nomor 8 Tahun 2007
"Staf Ahli Bidang Pengembangan Sektor Usaha Kecil Menengah
mempunyai tugas memberikan telaahan mengenai masalah
pengembangan sektor usaha kecil menengah.",Peraturan Presiden Nomor 176 Tahun 2000
"Subbagian Antar Negara mempunyai tugas melakukan urusan administrasi kerjasama dan bantuan luar
negeri antar negara di bidang lingkungan hidup.",Peraturan Menteri Nomor 9 Tahun 2001
"Perubahan atas susunan organisasi dan tata kerja menurut Keputusan ini ditetapkan oleh Meneg LH setelah
terlebih dahulu mendapat persetujuan tertulis dan Menteri yang bertanggung jawab di bidang pendayagunaan
aparatur negara. Bagan susunan organisasi Kantor Meneg LH sebagaimana tercantum dalam lampiran
merupakan bagian yang tidak terpisahkan dan Keputusan ini.",Peraturan Menteri Nomor 9 Tahun 2001
"Pemerintah dapat melakukan percepatan pembayaran
cicilan pokok utang dalam rangka pengelolaan portofolio
utang melalui penerbitan SBN.",Undang-Undang Nomor 27 Tahun 2014
"Team Peneliti mempunyai wewenang untuk :
a. Menghubungi instansi-instansi Sipil dan Militer baik di Pusat maupun di Daerah dalam
rangka pelaksanaan tugasnya ;
b. Mengadakan survey di daerah-daerah investasi kehutanan untuk memperoleh data-data
teknis yang diperlukan.",Peraturan Presiden Nomor 37 Tahun 1970
"Tahapan pemantauan dan evaluasi Kerja Sama
sebagaimana dimaksud dalam Pasal 9 ayat (1) huruf f,
dilakukan untuk memastikan agar tahapan proses kerja
sama mulai dari proses penjajakan sampai dengan
pelaksanaan dapat terlaksana.",Peraturan Menteri Nomor 2 Tahun 2021
Sanksi administratif dikenakan oleh Otoritas Jasa Keuangan.,Peraturan Pemerintah Nomor 25 Tahun 2020
"Komite lnvestasi Pemerintah adalah pihak yang memberikan kajian, penetapan kriteria, dan evaluasi atas pelaksanaan investasi pemerintah pusat serta melakukan pengendalian atas pengelolaan risiko.",Peraturan Pemerintah Nomor 8 Tahun 2007
Kekayaan negara yang dipisahkan sebagaimana dimaksud pada ayat (2) berupa penyertaan modal negara.,Peraturan Pemerintah Nomor 8 Tahun 2007
"Dalam pelaksanaan tugasnya, Komite Pengarah dan Kelompok Kerja
dapat mengundang atau meminta bantuan dari pejabat pemerintah
atau pihak lain yang dipandang perlu.",Peraturan Presiden Nomor 12 Tahun 2006
"Ketentuan lebih lanjut mengenai persyaratan dan tata cara Divestasi sebagaimana dimaksud pada ayat (66), ayat (67), dan ayat (68) diatur dengan Peraturan Menteri Keuangan.",Peraturan Pemerintah Nomor 1 Tahun 2008
Bank Kustodian wajib menyampaikan laporan keuangan tahunan Dana Tapera yang telah diaudit oleh akuntan publik kepada BP Tapera.,Peraturan Pemerintah Nomor 8 Tahun 2007
Rekening tabungan Jemaah Haji sebagaimana dimaksud pada ayat (1) dapat ditutup paling lambat 6 (enam) bulan setelah tanggal kedatangan kelompok terbang terakhir Jemaah Haji di Indonesia.,Peraturan Pemerintah Nomor 5 Tahun 2018
Ketentuan lebih lanjut mengenai tata cara penyusunan perencanaan Investasi Pemerintah sebagaimana dimaksud pada ayat (1) diatur dengan Peraturan Menteri Keuangan.,Peraturan Pemerintah Nomor 1 Tahun 2008
"Bidang Pengkajian Hukum Lingkungan 2 membawahkan:
Subbidang Pengkajian Pusat;
Subbidang Pengkajian Daerah.",Peraturan Menteri Nomor 9 Tahun 2001
"Bank Syariah yang telah mendapat izin usaha sebagaimana
dimaksud pada ayat (1) wajib mencantumkan dengan jelas
kata “syariah” pada penulisan nama banknya.",Undang-Undang Nomor 21 Tahun 2008
"Analisis sebagaimana dimaksud pada ayat (1), dilakukan
secara bersama oleh Pemrakarsa, Biro Perencanaan, Biro
Hukum dan/atau Asisten Deputi Hukum dan Perjanjian
Maritim serta dapat melibatkan Unit Kerja pada
Kementerian atau Lembaga terkait.",Peraturan Menteri Nomor 2 Tahun 2021
"Dalam melaksanakan tugas sebagaimana dimaksud dalam Pasal 29, Biro Perencanaan dan Kerjasama Luar
Negeri menyelenggarakan fungsi:
pelaksanaan koordinasi kegiatan penyusunan rencana dan program pengelolaan lingkungan hidup;
pelaksanaan pengelolaan data dan informasi lingkungan hidup;
pelaksanaan pengelolaan administrasi kerjasama internasional dan bantuan luar negeri di bidang
lingkungan hidup.",Peraturan Menteri Nomor 9 Tahun 2001
"Bidang Pengkajian hukum Lingkungan 3 mempunyai tugas dalam menyelenggarakan pengkajian dan evaluasi
perjanjian hukum lingkungan global dan regional.",Peraturan Menteri Nomor 9 Tahun 2001
"Penggunaan dana SAL, penarikan pinjaman siaga
dan/atau penerbitan SBN sebagai tambahan pembiayaan
sebagaimana dimaksud pada ayat (1) dilaporkan
Pemerintah dalam Laporan Keuangan Pemerintah Pusat
(LKPP) tahun 2015.",Undang-Undang Nomor 27 Tahun 2014
Data sebagaimana dimaksud pada ayat (3) harus diisi secara lengkap dan benar.,Peraturan Pemerintah Nomor 8 Tahun 2007
Badan Investasi Pemerintah wajib menatausahakan dan memelihara dokumen pengelolaan Investasi Pemerintah sesuai dengan ketentuan Peraturan Perundang-undangan.,Peraturan Pemerintah Nomor 1 Tahun 2008
"Tahapan pembahasan sebagaimana dimaksud pada ayat
(1), pada Kerja Sama Luar Negeri dilakukan secara bersama
oleh Pemrakarsa, Biro Perencanaan, Biro Hukum dan/atau
Asisten Deputi Hukum dan Perjanjian Maritim dengan
melibatkan Unit Kerja Kementerian atau Lembaga terkait,
dan Kementerian Luar Negeri.",Peraturan Menteri Nomor 2 Tahun 2021
"Belanja Daerah sebagaimana dimaksud dalam Pasal 2
Ayat
(2) terdiri dari bagian belanja Aparatur Daerah dan
bagian belanja Pelayanan Publik.",Peraturan Menteri Nomor 29 Tahun 2002
"Badan hukum asing dan/atau warga negara asing dan/atau badan hukum Indonesia
dan/atau warga negara Indonesia dapat mendirikan perusahaan baru dengan maksud
melakukan kegiatan dalam penyertaan modal pada perusahaan lain.",Peraturan Menteri Nomor 12 Tahun 1999
"Untuk mendapatkan pembiayaan perumahan sebagaimana dimaksud dalam Pasal 38, BP Tapera mengatur penilaian kelayakan Peserta oleh Bank atau Perusahaan Pembiayaan.",Peraturan Pemerintah Nomor 8 Tahun 2007
Tujuan Perusahaan ialah mengusahakan jasa pengerukan dalam rangka menunjang terselenggaranya kelancaran angkutan laut dan pembangunan lainnya.,Peraturan Pemerintah Nomor 18 Tahun 1983
"Bidang Ekosistem Pesisir mempunyai tugas melaksanakan koordinasi, penyusunan telaah staf, pengkajian dan
evaluasi serta penyusunan rancangan rumusan kebijakan mengenai pengelolaan ekosistem pesisir.",Peraturan Menteri Nomor 9 Tahun 2001
"Tahapan pengesahan naskah kesepakatan Kerja Sama
Dalam Negeri sebagaimana dimaksud pada ayat (1),
dilakukan secara bersama-sama oleh Biro Hukum dan Unit
Kerja terkait dengan Mitra Kerja Sama Dalam Negeri.",Peraturan Menteri Nomor 2 Tahun 2021
Menteri Teknis/Pimpinan Lembaga adalah pimpinan kementerian/lembaga yang ruang lingkup tugas dan tanggung jawabnya meliputi sektor infrastruktur dan non infrastruktur yang diatur dalam Peraturan Pemerintah ini.,Peraturan Pemerintah Nomor 8 Tahun 2007
"Rincian program Kementerian Negara/Lembaga yang dapat
digunakan sebagai dasar penerbitan SBSN ditetapkan oleh
Menteri Keuangan setelah pengesahan Undang-Undang
APBN Tahun Anggaran 2015 dan penetapan Peraturan
Presiden mengenai Rincian APBN Tahun Anggaran 2015.",Undang-Undang Nomor 27 Tahun 2014
"Subbidang pengkajian global mempunyai tugas melakukan pengkajian dan evaluasi perjanjian hukum
lingkungan global;",Peraturan Menteri Nomor 9 Tahun 2001
"Dukungan pemerintah sebagaimana dimaksud pada ayat (1) dan (2), dilakukan berdasarkan prinsip pengendalian dan pengelolaan risiko keuangan Anggaran Pendapatan dan Belanja Negara.",Peraturan Pemerintah Nomor 8 Tahun 2007
"Hak akses untuk Publik terhadap Klasifikasi Keamanan
Arsip Dinamis pada tingkat Terbatas dan Rahahsia
sebagaimana dimaksud dalam Pasal 3 huruf b dan huruf
c bersifat tertutup.",Peraturan Menteri Nomor 1 Tahun 2022
Besaran remunerasi sebagaimana dimaksud pada ayat (88) ditetapkan dengan Keputusan Menteri Keuangan.,Peraturan Pemerintah Nomor 8 Tahun 2007
"Tarif layanan pembiayaan ultra mikro melalui
pembiayaan konvensional sebagaimana dimaksud
dalam Pasal 2 huruf a merupakan tarif pembiayaan
kepada penyalur dan/ atau lembaga linkage dalam
bentuk tingkat suku bunga efektif per tahun.",Peraturan Menteri Nomor 1 Tahun 2021
Investasi dengan cara pembelian saham dapat dilakukan atas saham yang diterbitkan perusahaan.,Peraturan Pemerintah Nomor 1 Tahun 2008
"Keputusan Kepala Daerah sebagaimana dimaksud
pada Ayat
(7) menetapkan tujuan, besaran, dan sumber Dana
Deprisiasi serta jenis penggantian aktiva tetap yang
dibiayai dari Dana Deprisiasi tersebut.",Peraturan Menteri Nomor 29 Tahun 2002
"Pengeluaran pengembalian selisih saldo setoran BPIH dan/atau BPIH Khusus dari penetapan BPIH dan/atau BPIH Khusus tahun berjalan, sebagaimana dimaksud dalam Pasal 19 huruf h, dibayarkan kepada Jemaah Haji melalui rekening yang bersangkutan pada BPS BPIH.",Peraturan Pemerintah Nomor 5 Tahun 2018
"Aset Daerah berupa Aktiva Tetap selain tanah yang
digunakan untuk operasional secara langsung oleh
Pemerintah Daerah dideprisiasi dengan metode garis
lurus berdasarkan umur ekonomisnya.",Peraturan Menteri Nomor 29 Tahun 2002
"Pola penyaluran tidak langsung sebagaimana dimaksud
pada ayat ( 1) huruf b merupakan penyaluran
pembiayaan yang dilakukan oleh penyalur kepada
debitur melalui lembaga linkage.",Peraturan Menteri Nomor 1 Tahun 2021
"Mengambil langkah-langkah yang diperlukan sesuai tugas, fungsi,
dan kewenangan masing-masing untuk melaksanakan komitmen
Cetak Biru Masyarakat Ekonomi Association of Southeast Asian
Nations Tahun 2011 sebagaimana tercantum dalam lampiran yang
tidak terpisahkan dari Instruksi Presiden ini.",Peraturan Presiden Nomor 11 Tahun 2011
"Jumlah penggunaan SAL dalam rangka stabilisasi pasar
SBN sebagaimana dimaksud pada ayat (1) dilaporkan
Pemerintah dalam APBN Perubahan Tahun Anggaran 2015
dan/atau Laporan Keuangan Pemerintah Pusat (LKPP)
Tahun 2015.",Undang-Undang Nomor 27 Tahun 2014
"Perusahaan PMDN dan Non PMA/PMDN yang telah sah berbadan hukum sebagaimana
dimaksud pada Pasal 1 ayat (2) yang sahamnya akan dibeli oleh Badan Hukum asing
dan/atau warga negara asing dan/atau PMA wajib mengajukan permohonan kepada
Menteri Negara Investasi/Kepala Badan Koordinasi Penanaman Modal dengan
menggunakan bentuk formula seperti pada Lampiran II.",Peraturan Menteri Nomor 12 Tahun 1999
"Subbidang Atmosfer Bawah (Udara) mempunyai tugas melakukan penyiapan bahan koordinasi, telaah
staf, pengkajian dan evaluasi serta penyusunan rancangan rumusan kebijakan pengelolaan atmosfer
bawah.",Peraturan Menteri Nomor 9 Tahun 2001
Menteri menetapkan kebijaksanaan umum mengenai tujuan dan lapangan usaha Perusahaan sebagaimana dimaksud dalam Pasal 5 dan Pasal 6 Peraturan Pemerintah ini.,Peraturan Pemerintah Nomor 18 Tahun 1983
"Direksi terdiri dari sekurang-kurangnya dua orang Direktur.
Salah seorang dari anggota-anggota Direksi dapat diangkat sebagai
Presiden Direktur.",Peraturan Pemerintah Pengganti Undang-Undang Nomor 21 Tahun 1960
"Subbidang Pengkajian Pusat mempunyai tugas melakukan kajian dan evaluasi mengenai Harmonisasi
dan Sinkronisasi hukum Lingkungan yang berkait dengan pusat.",Peraturan Menteri Nomor 9 Tahun 2001
"Dalam hal Investasi Pemerintah dilakukan dengan pola kerjasama pemerintah dan swasta (Public Private Partnership) dalam rangka penyediaan infrastruktur dan bidang lainnya, Badan Investasi Pemerintah dapat memberikan dukungan finansial dan/atau dukungan lainnya.",Peraturan Pemerintah Nomor 1 Tahun 2008
"Pada saat Peraturan Presiden ini mulai berlaku, seluruh
jabatan yang ada beserta pejabat yang memangku
jabatan di Kementerian Pendidikan dan Kebudayaan
dan Badan Koordinasi Penanaman Modal tetap
melaksanakan tugas dan fungsinya sampai dengan
diatur kembali dengan Peraturan Presiden mengenai
organisasi dan tata kerja Kementerian Pendidikan,
Kebudayaan, Riset, dan Teknologi dan Kementerian
Investasi lBadan Koordinasi Penanaman Modal.",Peraturan Presiden Nomor 31 Tahun 2021
"Perintah tertulis sebagaimana dimaksud pada ayat (1) harus
menyebutkan nama pejabat pajak, nama nasabah wajib
pajak, dan kasus yang dikehendaki keterangannya.",Undang-Undang Nomor 21 Tahun 2008
Nilai manfaat Keuangan Haji ditempatkan di rekening nilai manfaat atas nama BPKH pada BPS BPIH yang ditunjuk oleh BPKH.,Peraturan Pemerintah Nomor 5 Tahun 2018
Semua aset untuk dan atas nama Badan Pertimbangan Tabungan Perumahan Pegawai Negeri Sipil dilikuidasi setelah dilakukan audit sesuai mekanisme sebagaimana dimaksud dalam Pasal 74 Undang-Undang Nomor 4 Tahun 2016 tentang Tabungan Perumahan Rakyat.,Peraturan Pemerintah Nomor 8 Tahun 2007
PSBDT adalah Piutang Negara Sementara Belum Dapat Ditagih.,Peraturan Pemerintah Nomor 8 Tahun 2007
"Selisih antara Anggaran Pendapatan Daerah dan
Anggaran Belanja Daerah dapat mengakibatkan
terjadinya surplus atau defisit anggaran.",Peraturan Menteri Nomor 29 Tahun 2002
"Pekerja Mandiri yang melanggar ketentuan sebagaimana dimaksud dalam Pasal 5 ayat (3), Pasal 21 ayat (1), Pasal 21 ayat (3), dan Pasal 50 ayat (1) dikenai sanksi administratif berupa peringatan tertulis.",Peraturan Pemerintah Nomor 8 Tahun 2007
"Dua orang anggota Direksi tidak boleh bersama-sama menjadi
Komisaris pada satu perusahaan.",Peraturan Pemerintah Pengganti Undang-Undang Nomor 21 Tahun 1960
"Bank Umum Syariah hanya dapat didirikan dan/atau
dimiliki oleh:
a. warga negara Indonesia dan/atau badan hukum
Indonesia;
b. warga negara Indonesia dan/atau badan hukum
Indonesia dengan warga negara asing dan/atau badan
hukum asing secara kemitraan; atau
c. pemerintah daerah.",Undang-Undang Nomor 21 Tahun 2008
Besaran Simpanan Peserta sebagaimana dimaksud pada ayat (1) dan ayat (2) dapat dilakukan evaluasi.,Peraturan Pemerintah Nomor 25 Tahun 2020
Ketentuan lebih lanjut mengenai bentuk dan isi laporan pengelolaan program sebagaimana dimaksud pada ayat (3) dan ayat (7) diatur dengan Peraturan BP Tapera setelah disetujui Komite Tapera.,Peraturan Pemerintah Nomor 8 Tahun 2007
Investasi Keuangan Haji dalam bentuk surat berharga sebagaimana dimaksud dalam Pasal 26 ayat (1) meliputi: a. surat berharga syariah negara yang diterbitkan oleh pemerintah pusat; b. surat berharga syariah yang diterbitkan oleh Bank Indonesia; dan c. efek syariah yang diatur dan diawasi oleh Otoritas Jasa Keuangan.,Peraturan Pemerintah Nomor 5 Tahun 2018
"Pemerintah Daerah adalah Gubernur, Bupati, atau Walikota, dan perangkat daerah sebagai unsur penyelenggara pemerintahan daerah.",Peraturan Pemerintah Nomor 14 Tahun 2005
"Biaya Penyelenggaraan Ibadah Haji, yang selanjutnya disingkat BPIH adalah sejumlah dana yang harus dibayar oleh warga negara yang akan menunaikan ibadah haji.",Peraturan Pemerintah Nomor 5 Tahun 2018
"Besaran Simpanan Peserta sebagaimana dimaksud pada ayat (1) untuk Peserta Pekerja ditanggung bersama oleh Pemberi Kerja sebesar 0,5% (nol koma lima persen) dan Pekerja sebesar 2,5% (dua koma lima persen).",Peraturan Pemerintah Nomor 25 Tahun 2020
"Dalam melaksanakan tugas sebagaimana dimaksud dalam Pasal 161 ayat (1), Staf Ahli Bidang Peran
Masyarakat menyelenggarakan fungsi penelaahan aspek peran masyarakat dalam rangka perumusan
kebijakan di bidang lingkungan hidup.",Peraturan Menteri Nomor 9 Tahun 2001
"Bidang Perancangan Hukum Lingkungan 1 mempunyai tugas dalam menyelenggarakan perancangan dan
perumusan kebijakan hukum Lingkungan yang berkaitan dengan peraturan perundangan internal dan eksternal.",Peraturan Menteri Nomor 9 Tahun 2001
"Dalam hal terjadi penurunan harga/nilai surat berharga secara signifikan, badan investasi pemerintah dapat menghentikan investasi dengan menjual surat berharga sebagaimana dimaksud pada ayat (1) dan (2) kurang dari 12 (dua belas) bulan.",Peraturan Pemerintah Nomor 8 Tahun 2007
"Pemerintah dapat melakukan transaksi Lindung Nilai
dalam rangka pengendalian risiko pembayaran bunga
utang dan pengeluaran cicilan pokok utang.",Undang-Undang Nomor 27 Tahun 2014
"Subbidang Pranata Adat mempunyai tugas melakukan penyusunan bahan koordinasi telaahan staf,
pengkajian dan evaluasi serta penyusunan rancangan rumusan kebijakan di bidang pranata adat:",Peraturan Menteri Nomor 9 Tahun 2001
"Pendapatan bagian laba BUMN sebagaimana dimaksud
pada ayat (1) huruf b direncanakan sebesar
Rp44.000.000.000.000,00 (empat puluh empat triliun
rupiah).",Undang-Undang Nomor 27 Tahun 2014
"Penyelenggaraan Ibadah Haji adalah rangkaian kegiatan pengelolaan pelaksanaan Ibadah Haji yang meliputi pelaksanaan pembinaan, pelayanan, dan perlindungan Jemaah Haji yang diselenggarakan oleh Pemerintah.",Peraturan Pemerintah Nomor 5 Tahun 2018
"Dalam pelaksanaan tugasnya, Komite Pengarah dibantu oleh
Kelompok Kerja yang diketuai oleh Menteri Perdagangan dan
Kepala Badan Koordinasi Penanaman Modal selaku Pelaksana
Harian.",Peraturan Presiden Nomor 12 Tahun 2006
"Dalam hal terjadi krisis pasar SBN domestik, Pemerintah
dengan persetujuan Dewan Perwakilan Rakyat diberikan
kewenangan menggunakan SAL untuk melakukan
stabilisasi pasar SBN domestik setelah memperhitungkan
kebutuhan anggaran sampai dengan akhir tahun anggaran
berjalan dan awal tahun anggaran berikutnya.",Undang-Undang Nomor 27 Tahun 2014
"Naskah Kesepakatan Kerja Sama paling sedikit memuat:
tujuan Kerja Sama;
ruang lingkup Kerja Sama;
perencanaan, pengaturan pelaksanaan dan evaluasi
pelaksanaan;
perubahan;
penyelesaian perselisihan; dan
masa berlaku dan berakhirnya kesepakatan.",Peraturan Menteri Nomor 2 Tahun 2021
Besaran pengeluaran Penyelenggaraan Ibadah Haji sebagaimana dimaksud pada ayat (1) ditetapkan oleh pemerintah pusat setelah mendapat persetujuan Dewan Perwakilan Rakyat.,Peraturan Pemerintah Nomor 5 Tahun 2018
Peserta sebagaimana dimaksud pada ayat (1) berakhir kepesertaannya apabila: a. meninggal dunia; atau b. mengundurkan diri dan mengklaim pengembalian Simpanan.,Peraturan Pemerintah Nomor 8 Tahun 2007
"Subbidang Sumber Pendanaan Lingkungan mempunyai tugas melakukan penyiapan bahan koordinasi,
telaahan staf, pengkajian dan evaluasi serta penyusunan rancangan rumusan kebijakan di bidang sumber
pendanaan Lingkungan.",Peraturan Menteri Nomor 9 Tahun 2001
Pertanggungjawaban likuidasi oleh likuidatur dilakukan kepada Menteri yang memberi pembebasan tanggung jawab tentang pekerjaan yang telah diselesaikan olehnya.,Peraturan Pemerintah Nomor 8 Tahun 2007
"Perpanjangan dapat dilaksanakan jika:
disepakati oleh Kementerian Koordinator dan Mitra
Kerja Sama; dan
telah melalui tahap pembahasan, pengesahan, dan
penandatanganan berdasarkan hasil evaluasi
pelaksanaan Kerja Sama terdahulu.",Peraturan Menteri Nomor 2 Tahun 2021
"Ketentuan lebih lanjut mengenai tata cara pengembalian saldo BPIH dan/atau BPIH Khusus serta pengembalian selisih saldo, sebagaimana dimaksud pada ayat (1) dan ayat (2), diatur dengan Peraturan BPKH.",Peraturan Pemerintah Nomor 5 Tahun 2018
Modal adalah aset dalam bentuk uang atau bentuk lain yang bukan uang yang dimiliki oleh Investor yang mempunyai nilai ekonomis.,Peraturan Pemerintah Nomor 24 Tahun 2019
Pemberian Insentif dan/atau Pemberian Kemudahan dapat ditinjau kembali apabila berdasarkan evaluasi tidak lagi memenuhi kriteria sebagaimana dimaksud dalam Pasal 4 atau bertentangan dengan ketentuan peraturan perundang-undangan.,Peraturan Pemerintah Nomor 24 Tahun 2019
"Staf Menteri Negara Lingkungan Hidup, selanjutnya dalam Keputusan ini disebut staf Meneg LH, adalah unsur
pembantu atau unsur pelaksana Meneg LH yang berada di bawah dan bertanggung jawab kepada Meneg LH.",Peraturan Menteri Nomor 9 Tahun 2001
"Bagian Perencanaan mempunya tugas melaksanakan penyiapan koordinasi perencanaan dan evaluasi
pelaksanaan program pengelolaan lingkungan hidup.",Peraturan Menteri Nomor 9 Tahun 2001
"Surat-paksa tersebut pada ayat (1) dikeluarkan oleh Menteri
yang bersangkutan.",Peraturan Pemerintah Pengganti Undang-Undang Nomor 7 Tahun 1962
"Panitia mempunyai sebuah Sekretariat yang terdiri atas seorang
Sekretaris dibantu oleh beberapa orang tenaga ahli dan beberapa orang
tenaga pembantu, yang semuanya termasuk staf pegawai BAPPENAS.",Peraturan Presiden Nomor 10 Tahun 1964
"Dengan Peraturan Pemerintah dapat diadakan pengecualian dari
sumbangan wajib seperti termaksud pada ayat-ayat (1) dan (2) di
atas.",Undang-Undang Nomor 34 Tahun 1964
Laporan keuangan Badan Investasi Pemerintah yang belum diaudit disampaikan kepada Menteri Keuangan setiap tahun anggaran paling lambat 2 (dua) bulan setelah tahun anggaran berakhir.,Peraturan Pemerintah Nomor 1 Tahun 2008
Manajer Investasi melakukan pemupukan Dana Tapera yang dialokasikan sebagaimana dimaksud dalam Pasal 18 ayat (3).,Peraturan Pemerintah Nomor 25 Tahun 2020
"Naskah Kesepakatan Kerja Sama mencakup materi
kesepakatan yang bersifat pokok atau prinsip dan/atau
implementatif.",Peraturan Menteri Nomor 2 Tahun 2021
Investasi lainnya sebagaimana dimaksud pada ayat (1) paling banyak 10% (sepuluh persen) dari total penempatan dan/atau investasi Keuangan Haji.,Peraturan Pemerintah Nomor 5 Tahun 2018
"Segala biaya yang diperlukan bagi pelaksanaan tugas Satgas
Investasi, Sekretariat Satgas Investasi, dan Tim Pelaksana
dibebankan pada Anggaran Pendapatan dan Belanja Negara
melalui Anggaran Belanja Kementerian Investasi/Badan
Koordinasi Penanaman Modal.",Peraturan Presiden Nomor 11 Tahun 2021
"Menteri Keuangan diberikan wewenang untuk
menyelesaikan piutang instansi Pemerintah yang
diurus/dikelola oleh Panitia Urusan Piutang
Negara/Direktorat Jenderal Kekayaan Negara, khususnya
piutang terhadap usaha mikro, kecil, dan menengah
(UMKM), dan piutang berupa Kredit Pemilikan Rumah
Sederhana/Rumah Sangat Sederhana (KPR RS/RSS),
meliputi dan tidak terbatas pada restrukturisasi dan
pemberian keringanan utang pokok sampai dengan 100%
(seratus persen).",Undang-Undang Nomor 27 Tahun 2014
"Piutang Negara yang bersumber dari penerusan Pinjaman Luar Negeri/Rekening Dana Investasi/Rekening Pembangunan Daerah, dapat dilakukan penghapusan secara bersyarat atau mutlak sebagaimana dimaksud dalam Pasal 2.",Peraturan Pemerintah Nomor 14 Tahun 2005
"Satgas Investasi sebagaimana dimaksud dalam Pasal 1 terdiri
atas:
a. Ketua : Menteri Investasi/Kepala Badan
Koordinasi Penanaman Modal;
b. Wakil Ketua I : Wakil Jaksa Agung;
c. Wakil Ketua II : Wakil Kepala Kepolisian Negara
Republik Indonesia;
d. Sekretaris : Sdri. Dini Purwono.",Peraturan Presiden Nomor 11 Tahun 2021
"PNBP lainnya sebagaimana dimaksud pada ayat (1) huruf c
direncanakan sebesar Rp89.823.662.775.000,00 (delapan
puluh sembilan triliun delapan ratus dua puluh tiga miliar
enam ratus enam puluh dua juta tujuh ratus tujuh puluh
lima ribu rupiah).",Undang-Undang Nomor 27 Tahun 2014
"Modal dasar tersebut pada ayat (1) pasal ini dapat diperbesar
dengan ketentuan Undang-undang.",Peraturan Pemerintah Pengganti Undang-Undang Nomor 21 Tahun 1960
Pelaksanaan investasi pemerintah melalui pembelian saham dapat dilaksanakan atas saham yang diterbitkan perusahaan.,Peraturan Pemerintah Nomor 8 Tahun 2007
Pengelolaan Tapera sebagaimana dimaksud pada ayat (1) dilakukan dengan memperhatikan kebijakan di bidang perumahan dan kawasan permukiman.,Peraturan Pemerintah Nomor 25 Tahun 2020
Setoran awal BPIH dan/atau BPIH Khusus dibayarkan melalui rekening tabungan Jemaah Haji di BPS BPIH ke rekening setoran awal atas nama BPKH selaku wakil yang sah dari Jemaah Haji sebagai salah satu syarat untuk memperoleh nomor porsi Jemaah Haji pada saat mendaftar sebagai Jemaah Haji.,Peraturan Pemerintah Nomor 5 Tahun 2018
"Calon dewan komisaris dan calon direksi wajib lulus uji
kemampuan dan kepatutan yang dilakukan oleh Bank
Indonesia.",Undang-Undang Nomor 21 Tahun 2008
"Tarif layanan pembiayaan ultra mikro melalui
pembiayaan syariah sebagaimana dimaksud dalam
Pasal 2 huruf b merupakan tarif pembiayaan kepada
penyalur dan/ atau lembaga linkage dalam bentuk
imbal hasil sesuai dengan prinsip syariah.",Peraturan Menteri Nomor 1 Tahun 2021
Persentase imbal jasa Bank Kustodian dituangkan dalam kontrak penunjukan Bank Kustodian.,Peraturan Pemerintah Nomor 8 Tahun 2007
"Atas usul Direksi, Menteri menetapkan tarip bagi jasa pengerukan sesuai dengan ketentuan-ketentuan yang berlaku.",Peraturan Pemerintah Nomor 8 Tahun 2007
